{
  "processing_metadata": {
    "document_path": "data/sample_financial_report.pdf",
    "processing_time": "2025-07-06T02:53:15.367258",
    "use_rag": true,
    "processing_id": "proc_20250706_025315"
  },
  "parsed_document": {
    "file_path": "data/sample_financial_report.pdf",
    "raw_text": "TECHCORP FINANCIAL REPORT - Q4 2023\nEXECUTIVE SUMMARY\nTechCorp Inc. delivered strong financial performance in Q4 2023, with record quarterly revenue of $2.8\nbillion, representing a 15% increase compared to Q4 2022. The company's focus on innovation and\noperational efficiency has resulted in improved profitability and market position.\nFINANCIAL HIGHLIGHTS\nRevenue Performance:\n- Total Revenue: $2.8 billion (Q4 2023) vs $2.43 billion (Q4 2022)\n- Year-over-Year Growth: 15.2%\n- Product Revenue: $2.1 billion (75% of total revenue)\n- Services Revenue: $700 million (25% of total revenue)\nProfitability Metrics:\n- Gross Profit: $1.68 billion\n- Gross Margin: 60%\n- Operating Income: $560 million\n- Operating Margin: 20%\n- Net Income: $420 million\n- Net Margin: 15%\nEarnings Per Share:\n- Diluted EPS: $2.85 (Q4 2023) vs $2.20 (Q4 2022)\n- Growth: 29.5%\nBALANCE SHEET STRENGTH\nAssets:\n- Total Assets: $8.5 billion\n- Cash and Cash Equivalents: $1.2 billion\n- Accounts Receivable: $890 million\n- Inventory: $340 million\nLiabilities and Equity:\n- Total Liabilities: $3.2 billion\n- Total Shareholders' Equity: $5.3 billion\n- Debt-to-Equity Ratio: 0.35\nCASH FLOW STATEMENT\nOperating Activities:\n- Net Cash from Operating Activities: $650 million\n- Free Cash Flow: $520 million\nInvesting Activities:\n- Capital Expenditures: $130 million\n- Research and Development: $280 million\nFinancing Activities:\n- Dividends Paid: $85 million\n- Share Repurchases: $200 million\nKEY FINANCIAL RATIOS\nLiquidity Ratios:\n- Current Ratio: 2.8\n- Quick Ratio: 2.1\n- Cash Ratio: 1.4\nProfitability Ratios:\n- Return on Assets (ROA): 12.5%\n- Return on Equity (ROE): 18.2%\n- Return on Investment (ROI): 15.8%\nEfficiency Ratios:\n- Asset Turnover: 0.83\n- Inventory Turnover: 8.2\n- Receivables Turnover: 12.5\nMARKET PERFORMANCE\nStock Information:\n- Stock Price (End of Q4): $145.50\n- Market Capitalization: $21.4 billion\n- Price-to-Earnings (P/E) Ratio: 18.5\n- Price-to-Book (P/B) Ratio: 3.2\nSEGMENT PERFORMANCE\nProduct Segment:\n- Revenue: $2.1 billion (15% YoY growth)\n- Operating Margin: 22%\n- Key Products: Software Solutions, Hardware Components\nServices Segment:\n- Revenue: $700 million (18% YoY growth)\n- Operating Margin: 16%\n- Key Services: Consulting, Support, Cloud Services\nYEAR-OVER-YEAR ANALYSIS\nRevenue Growth Drivers:\n- Increased demand for cloud services (+25%)\n- Strong performance in international markets (+20%)\n- New product launches contributing $180 million\nExpense Management:\n- Cost of Goods Sold: $1.12 billion (40% of revenue)\n- Operating Expenses: $1.12 billion (40% of revenue)\n- R&D; Investment: $280 million (10% of revenue)\nFORWARD GUIDANCE\nQ1 2024 Outlook:\n- Expected Revenue: $2.9 - $3.1 billion\n- Expected EPS: $2.95 - $3.05\n- Expected Operating Margin: 19% - 21%\nFull Year 2024 Guidance:\n- Revenue Growth: 12% - 15%\n- Operating Margin: 20% - 22%\n- Capital Expenditures: $500 - $600 million\nRISK FACTORS\nMarket Risks:\n- Increased competition in core markets\n- Economic uncertainty affecting customer spending\n- Foreign exchange rate fluctuations\nOperational Risks:\n- Supply chain disruptions\n- Cybersecurity threats\n- Talent acquisition and retention challenges\nRegulatory Risks:\n- Data privacy regulations\n- International trade policies\n- Environmental compliance requirements\nCONCLUSION\nTechCorp continues to demonstrate strong financial performance with robust revenue growth, improved\nprofitability, and solid balance sheet fundamentals. The company's strategic investments in innovation\nand operational efficiency position it well for continued success in 2024 and beyond.\nThe management team remains committed to delivering value to shareholders through sustained\ngrowth, prudent capital allocation, and maintaining industry-leading margins.\nCONTACT INFORMATION\nTechCorp Inc.\nInvestor Relations\nEmail: investor.relations@techcorp.com\nPhone: (555) 123-4567\nWebsite: www.techcorp.com/investors\nThis report contains forward-looking statements that involve risks and uncertainties. Actual results may\ndiffer materially from those projected.\n",
    "cleaned_text": "TECHCORP FINANCIAL REPORT - Q4 2023 EXECUTIVE SUMMARY TechCorp Inc. delivered strong financial performance in Q4 2023, with record quarterly revenue of $2.8 billion, representing a 15%increase compared to Q4 2022. The companys focus on innovation and operational efficiency has resulted in improved profitability and market position. FINANCIAL HIGHLIGHTS Revenue Performance: - Total Revenue: $2.8 billion (Q4 2023) vs $2.43 billion (Q4 2022) - Year-over-Year Growth: 15.2%- Product Revenue: $2.1 billion (75%of total revenue) - Services Revenue: $700 million (25%of total revenue) Profitability Metrics: - Gross Profit: $1.68 billion - Gross Margin: 60%- Operating Income: $560 million - Operating Margin: 20%- Net Income: $420 million - Net Margin: 15%Earnings Per Share: - Diluted EPS: $2.85 (Q4 2023) vs $2.20 (Q4 2022) - Growth: 29.5%BALANCE SHEET STRENGTH Assets: - Total Assets: $8.5 billion - Cash and Cash Equivalents: $1.2 billion - Accounts Receivable: $890 million - Inventory: $340 million Liabilities and Equity: - Total Liabilities: $3.2 billion - Total Shareholders Equity: $5.3 billion - Debt-to-Equity Ratio: 0.35 CASH FLOW STATEMENT Operating Activities: - Net Cash from Operating Activities: $650 million - Free Cash Flow: $520 million Investing Activities: - Capital Expenditures: $130 million - Research and Development: $280 million Financing Activities: - Dividends Paid: $85 million - Share Repurchases: $200 million KEY FINANCIAL RATIOS Liquidity Ratios: - Current Ratio: 2.8 - Quick Ratio: 2.1 - Cash Ratio: 1.4 Profitability Ratios: - Return on Assets (ROA): 12.5%- Return on Equity (ROE): 18.2%- Return on Investment (ROI): 15.8%Efficiency Ratios: - Asset Turnover: 0.83 - Inventory Turnover: 8.2 - Receivables Turnover: 12.5 MARKET PERFORMANCE Stock Information: - Stock Price (End of Q4): $145.50 - Market Capitalization: $21.4 billion - Price-to-Earnings (PE) Ratio: 18.5 - Price-to-Book (PB) Ratio: 3.2 SEGMENT PERFORMANCE Product Segment: - Revenue: $2.1 billion (15%YoY growth) - Operating Margin: 22%- Key Products: Software Solutions, Hardware Components Services Segment: - Revenue: $700 million (18%YoY growth) - Operating Margin: 16%- Key Services: Consulting, Support, Cloud Services YEAR-OVER-YEAR ANALYSIS Revenue Growth Drivers: - Increased demand for cloud services (+25%) - Strong performance in international markets (+20%) - New product launches contributing $180 million Expense Management: - Cost of Goods Sold: $1.12 billion (40%of revenue) - Operating Expenses: $1.12 billion (40%of revenue) - RD; Investment: $280 million (10%of revenue) FORWARD GUIDANCE Q1 2024 Outlook: - Expected Revenue: $2.9 - $3.1 billion - Expected EPS: $2.95 - $3.05 - Expected Operating Margin: 19%- 21%Full Year 2024 Guidance: - Revenue Growth: 12%- 15%- Operating Margin: 20%- 22%- Capital Expenditures: $500 - $600 million RISK FACTORS Market Risks: - Increased competition in core markets - Economic uncertainty affecting customer spending - Foreign exchange rate fluctuations Operational Risks: - Supply chain disruptions - Cybersecurity threats - Talent acquisition and retention challenges Regulatory Risks: - Data privacy regulations - International trade policies - Environmental compliance requirements CONCLUSION TechCorp continues to demonstrate strong financial performance with robust revenue growth, improved profitability, and solid balance sheet fundamentals. The companys strategic investments in innovation and operational efficiency position it well for continued success in 2024 and beyond. The management team remains committed to delivering value to shareholders through sustained growth, prudent capital allocation, and maintaining industry-leading margins. CONTACT INFORMATION TechCorp Inc. Investor Relations Email: investor.relationstechcorp.com Phone: (555) 123-4567 Website: www.techcorp.cominvestors This report contains forward-looking statements that involve risks and uncertainties. Actual results may differ materially from those projected.",
    "tables": [],
    "extraction_method": "PyMuPDF",
    "word_count": 554,
    "character_count": 4003
  },
  "financial_analysis": {
    "metrics": {
      "revenue": {
        "current_year": "$2.8 billion",
        "previous_year": "$2.43 billion",
        "growth_rate": "15.2%",
        "period": "Q4 2023"
      },
      "profit_metrics": {
        "net_income": "$420 million",
        "gross_profit": "$1.68 billion",
        "operating_income": "$560 million",
        "profit_margin": "15%"
      },
      "expenses": {
        "total_expenses": "$2.24 billion",
        "operating_expenses": "$1.12 billion",
        "cost_of_goods_sold": "$1.12 billion"
      },
      "key_ratios": {
        "debt_to_equity": "0.35",
        "current_ratio": "2.8",
        "return_on_equity": "18.2%",
        "earnings_per_share": "$2.85"
      },
      "year_over_year_changes": {
        "revenue_change": "15.2% increase",
        "profit_change": "29.5% increase (EPS growth)",
        "expense_change": "N/A (exact YoY expense not provided)"
      },
      "notable_trends": [
        "Strong revenue growth driven by 25% increase in cloud services and 20% growth in international markets",
        "Continued investment in R&D at 10% of revenue supporting innovation and product launches",
        "Balanced revenue stream with 75% from products and 25% from growing services segment"
      ],
      "risk_factors": [
        "Increased competition in core markets",
        "Economic uncertainty affecting customer spending",
        "Supply chain disruptions"
      ],
      "company_info": {
        "company_name": "TechCorp Inc.",
        "reporting_period": "Q4 2023",
        "currency": "USD",
        "fiscal_year_end": "December 31"
      }
    },
    "trends": [
      "Profit margin: 15%"
    ],
    "analysis_metadata": {
      "document_source": "data/sample_financial_report.pdf",
      "word_count": 554,
      "analysis_model": "usf1-mini",
      "has_context": true
    }
  },
  "executive_report": {
    "full_report": {
      "report_metadata": {
        "company_name": "TechCorp Inc.",
        "report_date": "2025-07-06T02:53:15.366842",
        "document_source": "data/sample_financial_report.pdf",
        "analysis_model": "usf1-mini",
        "word_count": 809
      },
      "executive_summary": "**TechCorp Inc. Q4 2023 Executive Financial Summary**\n\n---\n\n### 1. EXECUTIVE SUMMARY\n\nTechCorp Inc. delivered a robust financial performance in Q4 2023, highlighted by a 15.2% increase in revenue, reaching $2.8 billion, up from $2.43 billion the previous year. This growth reflects the company’s successful expansion in cloud services and international markets, fueled by continuous innovation and strategic investments in R&D. Profitability strengthened considerably, with net income at $420 million and a healthy profit margin of 15%, underscoring operational efficiency amid a competitive landscape.\n\nKey achievements include a balanced revenue mix with 75% stemming from product sales and a rapidly growing 25% services segment. However, challenges remain, such as increasing competition, economic uncertainties impacting customer spending, and persistent supply chain disruptions. Overall, TechCorp maintains solid financial health, supported by a strong current ratio of 2.8 and a conservative debt-to-equity ratio of 0.35, positioning the company well for sustainable growth and resilience in uncertain market conditions.\n\n---\n\n### 2. KEY FINANCIAL HIGHLIGHTS\n\n- **Revenue Performance:**  \n  - Q4 2023 revenue: $2.8 billion (15.2% YoY growth from $2.43 billion)  \n  - Growth driven by 25% increase in cloud services and 20% expansion in international sales\n\n- **Profitability Metrics:**  \n  - Net income: $420 million  \n  - Gross profit: $1.68 billion  \n  - Operating income: $560 million  \n  - Profit margin: 15%  \n  - Earnings per share (EPS): $2.85 (29.5% YoY increase)\n\n- **Expenses:**  \n  - Total expenses: $2.24 billion  \n  - Operating expenses: $1.12 billion  \n  - Cost of goods sold (COGS): $1.12 billion\n\n- **Key Financial Ratios:**  \n  - Debt-to-equity ratio: 0.35  \n  - Current ratio: 2.8 (strong liquidity position)  \n  - Return on equity (ROE): 18.2%\n\n---\n\n### 3. PERFORMANCE ANALYSIS\n\n**Strengths and Positive Indicators:**  \n- Sustained double-digit revenue growth driven by diversified business lines   \n- Robust profitability with a healthy 15% margin and a significant improvement in EPS indicating effective cost management  \n- Strong liquidity and conservative leverage reflecting prudent capital structure  \n- Strategic R&D investment at 10% of revenue fostering innovation and competitive advantage  \n\n**Areas of Concern:**  \n- Supply chain vulnerabilities could pose risks to timely product delivery and cost control  \n- Economic uncertainty remains a threat to steady customer demand  \n- Increasing competition in core markets necessitates ongoing innovation and market responsiveness  \n\n**Market Position & Competitive Landscape:**  \nTechCorp's balanced revenue streams across products (75%) and an expanding services segment (25%) enhance its market resilience. Its cloud services growth underscores its positioning in high-growth technology sectors, though competitive pressures demand continued agility.\n\n---\n\n### 4. TRENDS AND INSIGHTS\n\n- **Notable Patterns:**  \n  - Strong acceleration in cloud services (+25%) and international market expansion (+20%) driving overall revenue growth  \n  - Profit margin stability at 15% amidst growth, indicating efficient scale and cost control  \n  - Consistent R&D investment supporting frequent product launches and technology leadership  \n\n- **Seasonal/Cyclical Factors:**  \n  - Q4 performance reflects typical year-end demand upticks, supplemented by strategic investments and new market penetration  \n\n- **Growth Drivers:**  \n  - Cloud services and international expansion are key contributors  \n  - Innovation fueled by R&D powering competitive differentiation and customer value  \n\n- **Headwinds:**  \n  - Global economic uncertainties and supply chain challenges require vigilant operational management  \n\n---\n\n### 5. RISK ASSESSMENT\n\n- **Financial Risks:**  \n  - Potential margin compression due to supply chain cost fluctuations or pricing pressures  \n  - Exposure to foreign exchange and international market volatility given global expansion  \n\n- **Operational Risks:**  \n  - Supply chain disruptions impacting product availability  \n  - Scaling challenges balancing product and service delivery without margin dilution  \n\n- **Market & External Risks:**  \n  - Intensifying competition potentially eroding market share  \n  - Macro-economic conditions affecting customer spending patterns  \n\n---\n\n### 6. RECOMMENDATIONS\n\n- **Strategic Recommendations:**  \n  - Prioritize supply chain resilience initiatives including diversification and vertical integration  \n  - Continue aggressive R&D funding focusing on cloud service enhancements and emerging technologies  \n  - Expand international footprint selectively in high-growth, stable markets  \n\n- **Areas for Improvement:**  \n  - Enhance operational efficiencies to mitigate rising costs and maintain profit margins  \n  - Strengthen competitive intelligence efforts to respond proactively to market shifts  \n\n- **Investment Considerations:**  \n  - Leverage TechCorp’s strong balance sheet to pursue strategic acquisitions in cloud and services sectors to accelerate growth  \n  - Monitor economic indicators closely to adjust investment pacing and capital allocation  \n\n---\n\n### 7. CONCLUSION\n\nTechCorp Inc. has demonstrated solid financial strength and operational effectiveness in Q4 2023, capitalizing on key growth drivers such as cloud services and international market expansion. The company’s balanced and profitable business model, combined with sound liquidity and manageable debt levels, supports a positive outlook. While risks related to competition and supply chain persist, disciplined financial management and strategic innovation position TechCorp favorably for continued shareholder value creation.\n\nInvestors should consider TechCorp’s consistent growth trajectory, strong profitability, and commitment to innovation as key pillars underpinning a compelling investment opportunity. A cautious eye on external risks and ongoing operational improvements will be essential to sustain this momentum into future fiscal periods.\n\n---\n\nIf you need further detailed financial modeling or scenario analysis, feel free to ask!",
      "key_metrics_summary": {
        "revenue": {
          "current": "$2.8 billion",
          "previous": "$2.43 billion",
          "growth": "15.2%"
        },
        "profitability": {
          "net_income": "$420 million",
          "margin": "15%"
        },
        "key_ratios": {
          "debt_to_equity": "0.35",
          "current_ratio": "2.8",
          "return_on_equity": "18.2%",
          "earnings_per_share": "$2.85"
        }
      },
      "performance_indicators": {
        "revenue_trend": "POSITIVE",
        "profitability": "PROFITABLE"
      },
      "risk_factors": [
        "Increased competition in core markets",
        "Economic uncertainty affecting customer spending",
        "Supply chain disruptions"
      ],
      "trends": [
        "Profit margin: 15%"
      ],
      "raw_metrics": {
        "revenue": {
          "current_year": "$2.8 billion",
          "previous_year": "$2.43 billion",
          "growth_rate": "15.2%",
          "period": "Q4 2023"
        },
        "profit_metrics": {
          "net_income": "$420 million",
          "gross_profit": "$1.68 billion",
          "operating_income": "$560 million",
          "profit_margin": "15%"
        },
        "expenses": {
          "total_expenses": "$2.24 billion",
          "operating_expenses": "$1.12 billion",
          "cost_of_goods_sold": "$1.12 billion"
        },
        "key_ratios": {
          "debt_to_equity": "0.35",
          "current_ratio": "2.8",
          "return_on_equity": "18.2%",
          "earnings_per_share": "$2.85"
        },
        "year_over_year_changes": {
          "revenue_change": "15.2% increase",
          "profit_change": "29.5% increase (EPS growth)",
          "expense_change": "N/A (exact YoY expense not provided)"
        },
        "notable_trends": [
          "Strong revenue growth driven by 25% increase in cloud services and 20% growth in international markets",
          "Continued investment in R&D at 10% of revenue supporting innovation and product launches",
          "Balanced revenue stream with 75% from products and 25% from growing services segment"
        ],
        "risk_factors": [
          "Increased competition in core markets",
          "Economic uncertainty affecting customer spending",
          "Supply chain disruptions"
        ],
        "company_info": {
          "company_name": "TechCorp Inc.",
          "reporting_period": "Q4 2023",
          "currency": "USD",
          "fiscal_year_end": "December 31"
        }
      }
    },
    "dashboard_summary": {
      "company_name": "TechCorp Inc.",
      "report_date": "2025-07-06T02:53:15.366842",
      "key_metrics": {
        "revenue": {
          "current": "$2.8 billion",
          "previous": "$2.43 billion",
          "growth": "15.2%"
        },
        "profitability": {
          "net_income": "$420 million",
          "margin": "15%"
        },
        "key_ratios": {
          "debt_to_equity": "0.35",
          "current_ratio": "2.8",
          "return_on_equity": "18.2%",
          "earnings_per_share": "$2.85"
        }
      },
      "performance_indicators": {
        "revenue_trend": "POSITIVE",
        "profitability": "PROFITABLE"
      },
      "top_risks": [
        "Increased competition in core markets",
        "Economic uncertainty affecting customer spending",
        "Supply chain disruptions"
      ],
      "key_trends": [
        "Profit margin: 15%"
      ],
      "overall_health": "HEALTHY"
    }
  },
  "system_state": {
    "documents_processed": 1,
    "analysis_performed": 1,
    "reports_generated": 1,
    "errors": []
  }
}